{
  "session_id": "c78bbd37-4508-4a9e-a506-22b6e3bcb06d",
  "source_type": "text",
  "source_ref": "低质量源",
  "state": "S_PREREAD",
  "template_id": "default",
  "max_turns": 5,
  "ask_user_on_ambiguity": true,
  "turns": [
    {
      "turn_index": 0,
      "state": "S_INIT",
      "agent_action": "proceed",
      "agent_output": "[DistillationService] 初始化会话",
      "user_response": null,
      "timestamp": "2026-07-18T14:58:31.655997+00:00"
    },
    {
      "turn_index": 1,
      "state": "S_PREREAD",
      "agent_action": "proceed",
      "agent_output": "[S_PREREAD] 数据源类型=text, 模板=default。\n预读摘要: [MultimodalArtifact type=text native_decode=False vision_degraded=False] 低质量源",
      "user_response": null,
      "timestamp": "2026-07-18T14:58:31.655997+00:00"
    }
  ],
  "preread_summary": "[S_PREREAD] 数据源类型=text, 模板=default。\n预读摘要: [MultimodalArtifact type=text native_decode=False vision_degraded=False] 低质量源",
  "ambiguity_questions": [
    "1. 文本中的关键实体是否需要归一化？",
    "2. 时间戳是否需要转换为 UTC？"
  ],
  "extracted_content": null,
  "quality_score": null,
  "created_at": "2026-07-18T14:58:31.655997+00:00",
  "updated_at": "2026-07-18T14:58:31.655997+00:00",
  "finalized_at": null,
  "is_finalized": false,
  "error_message": null
}