{
  "session_id": "d8558967-8b91-4050-be36-b55603874118",
  "source_type": "text",
  "source_ref": "回环测试：验证 S_REFLECT → S_QUESTION 的 D4 决策回环逻辑。",
  "state": "S_QUESTION",
  "template_id": "default",
  "max_turns": 6,
  "ask_user_on_ambiguity": false,
  "turns": [
    {
      "turn_index": 0,
      "state": "S_INIT",
      "agent_action": "proceed",
      "agent_output": "[DistillationService] 初始化会话",
      "user_response": null,
      "timestamp": "2026-07-19T11:21:52.310581+00:00"
    },
    {
      "turn_index": 1,
      "state": "S_PREREAD",
      "agent_action": "proceed",
      "agent_output": "[S_PREREAD] 数据源类型=text, 模板=default。\n预读摘要: [MultimodalArtifact type=text native_decode=False vision_degraded=False] 回环测试:验证 S_REFLECT → S_QUESTION 的 D4 决策回环逻辑。",
      "user_response": null,
      "timestamp": "2026-07-19T11:21:52.310581+00:00"
    },
    {
      "turn_index": 2,
      "state": "S_QUESTION",
      "agent_action": "proceed",
      "agent_output": "[DistillationService] 进入 S_QUESTION 状态",
      "user_response": "继续",
      "timestamp": "2026-07-19T11:21:52.419707+00:00"
    },
    {
      "turn_index": 3,
      "state": "S_REFLECT",
      "agent_action": "proceed",
      "agent_output": "[DistillationService] 进入 S_REFLECT 状态",
      "user_response": "继续",
      "timestamp": "2026-07-19T11:21:52.528193+00:00"
    },
    {
      "turn_index": 4,
      "state": "S_QUESTION",
      "agent_action": "reflect",
      "agent_output": "[DistillationService] D4 决策回环至 S_QUESTION (redistill_count=1, max_redistill_turns=2)",
      "user_response": null,
      "timestamp": "2026-07-19T11:21:52.636987+00:00"
    }
  ],
  "preread_summary": "[S_PREREAD] 数据源类型=text, 模板=default。\n预读摘要: [MultimodalArtifact type=text native_decode=False vision_degraded=False] 回环测试:验证 S_REFLECT → S_QUESTION 的 D4 决策回环逻辑。",
  "ambiguity_questions": [
    "1. 文本中的关键实体是否需要归一化？",
    "2. 时间戳是否需要转换为 UTC？"
  ],
  "extracted_content": null,
  "quality_score": null,
  "created_at": "2026-07-19T11:21:52.310581+00:00",
  "updated_at": "2026-07-19T11:21:52.636987+00:00",
  "finalized_at": null,
  "is_finalized": false,
  "error_message": null
}