{
  "session_id": "79d0504c-bcc7-4ebb-92ff-65e0c1823110",
  "source_type": "video",
  "source_ref": "test_video.mp4",
  "state": "S_PREREAD",
  "template_id": "default",
  "max_turns": 4,
  "ask_user_on_ambiguity": true,
  "turns": [
    {
      "turn_index": 0,
      "state": "S_INIT",
      "agent_action": "proceed",
      "agent_output": "[DistillationService] 初始化会话",
      "user_response": null,
      "timestamp": "2026-07-19T14:09:16.382200+00:00"
    },
    {
      "turn_index": 1,
      "state": "S_PREREAD",
      "agent_action": "proceed",
      "agent_output": "[S_PREREAD] 数据源类型=video, 模板=default。\n预读摘要: [DistillationService] MultimodalPipeline 预处理降级: source_type=video, source_ref=test_video.mp4, error=video 文件不存在（404）: test_video.mp4",
      "user_response": null,
      "timestamp": "2026-07-19T14:09:16.382200+00:00"
    }
  ],
  "preread_summary": "[S_PREREAD] 数据源类型=video, 模板=default。\n预读摘要: [DistillationService] MultimodalPipeline 预处理降级: source_type=video, source_ref=test_video.mp4, error=video 文件不存在（404）: test_video.mp4",
  "ambiguity_questions": [
    "1. 视频关键帧抽取的时间间隔是多少？",
    "2. 视频转录文本是否需要分句存储？"
  ],
  "extracted_content": null,
  "quality_score": null,
  "created_at": "2026-07-19T14:09:16.382200+00:00",
  "updated_at": "2026-07-19T14:09:16.382200+00:00",
  "finalized_at": null,
  "is_finalized": false,
  "error_message": null
}