{
  "session_id": "e45016da-5bfc-4e95-814d-70b9d4043ebc",
  "source_type": "text",
  "source_ref": "测试文本：用于验证蒸馏状态机正常推进的输入数据。",
  "state": "S_FINALIZE",
  "template_id": "default",
  "max_turns": 4,
  "ask_user_on_ambiguity": false,
  "turns": [
    {
      "turn_index": 0,
      "state": "S_INIT",
      "agent_action": "proceed",
      "agent_output": "[DistillationService] 初始化会话",
      "user_response": null,
      "timestamp": "2026-07-20T05:27:30.372313+00:00"
    },
    {
      "turn_index": 1,
      "state": "S_PREREAD",
      "agent_action": "proceed",
      "agent_output": "[S_PREREAD] 数据源类型=text, 模板=default。\n预读摘要: [MultimodalArtifact type=text native_decode=False vision_degraded=False] 测试文本:用于验证蒸馏状态机正常推进的输入数据。",
      "user_response": null,
      "timestamp": "2026-07-20T05:27:30.372313+00:00"
    },
    {
      "turn_index": 2,
      "state": "S_QUESTION",
      "agent_action": "proceed",
      "agent_output": "[DistillationService] 进入 S_QUESTION 状态",
      "user_response": "继续",
      "timestamp": "2026-07-20T05:27:30.483250+00:00"
    },
    {
      "turn_index": 3,
      "state": "S_REFLECT",
      "agent_action": "proceed",
      "agent_output": "[DistillationService] 进入 S_REFLECT 状态",
      "user_response": "继续",
      "timestamp": "2026-07-20T05:27:30.592996+00:00"
    },
    {
      "turn_index": 4,
      "state": "S_CROSSVALIDATE",
      "agent_action": "proceed",
      "agent_output": "[DistillationService] D4 决策不回环，进入 S_CROSSVALIDATE (redistill_count=0, max_redistill_turns=2)",
      "user_response": null,
      "timestamp": "2026-07-20T05:27:30.702107+00:00"
    },
    {
      "turn_index": 5,
      "state": "S_EXTRACT",
      "agent_action": "proceed",
      "agent_output": "[DistillationService] D5 跳过跨源验证",
      "user_response": null,
      "timestamp": "2026-07-20T05:27:30.810992+00:00"
    },
    {
      "turn_index": 6,
      "state": "S_STORAGE_DECISION",
      "agent_action": "extract",
      "agent_output": "[DistillationService] 抽取结果: [S_EXTRACT] 结构化抽取结果:\n- source_type: text\n- template_id: default\n- preread_summary: [S_PREREAD] 数据源类型=text, 模板=default。\n预读摘要: [MultimodalArtifact type=text native_decode=False vision_degraded=False] 测试...",
      "user_response": null,
      "timestamp": "2026-07-20T05:27:30.919753+00:00"
    },
    {
      "turn_index": 7,
      "state": "S_FINALIZE",
      "agent_action": "decide",
      "agent_output": "[DistillationService] D1 决策存储位置 (quality_score=0.3)",
      "user_response": null,
      "timestamp": "2026-07-20T05:27:32.303198+00:00"
    },
    {
      "turn_index": 8,
      "state": "S_FINALIZE",
      "agent_action": "finalize",
      "agent_output": "importance=0.75 >= importance_threshold_permanent=0.7，存入永久记忆",
      "user_response": null,
      "timestamp": "2026-07-20T05:27:32.432881+00:00"
    }
  ],
  "preread_summary": "[S_PREREAD] 数据源类型=text, 模板=default。\n预读摘要: [MultimodalArtifact type=text native_decode=False vision_degraded=False] 测试文本:用于验证蒸馏状态机正常推进的输入数据。",
  "ambiguity_questions": [
    "1. 文本中的关键实体是否需要归一化？",
    "2. 时间戳是否需要转换为 UTC？"
  ],
  "extracted_content": "[S_EXTRACT] 结构化抽取结果:\n- source_type: text\n- template_id: default\n- preread_summary: [S_PREREAD] 数据源类型=text, 模板=default。\n预读摘要: [MultimodalArtifact type=text native_decode=False vision_degraded=False] 测试文本:用于验证蒸馏状态机正常推进的输入数据。\n- turns_count: 6\n",
  "quality_score": 0.3,
  "created_at": "2026-07-20T05:27:30.372313+00:00",
  "updated_at": "2026-07-20T05:27:32.432881+00:00",
  "finalized_at": "2026-07-20T05:27:32.432881+00:00",
  "is_finalized": true,
  "error_message": null
}