{
  "session_id": "cc66053a-5b9c-4967-a467-156e26dc7de5",
  "source_type": "character_card",
  "source_ref": "{\"name\":\"测试角色\",\"description\":\"多模态测试用角色卡\",\"personality\":\"沉稳\"}",
  "state": "S_PREREAD",
  "template_id": "default",
  "max_turns": 4,
  "ask_user_on_ambiguity": true,
  "turns": [
    {
      "turn_index": 0,
      "state": "S_INIT",
      "agent_action": "proceed",
      "agent_output": "[DistillationService] 初始化会话",
      "user_response": null,
      "timestamp": "2026-07-19T11:14:44.646031+00:00"
    },
    {
      "turn_index": 1,
      "state": "S_PREREAD",
      "agent_action": "proceed",
      "agent_output": "[S_PREREAD] 数据源类型=character_card, 模板=default。\n预读摘要: [MultimodalArtifact type=character_card native_decode=False vision_degraded=False] {\n  \"name\": \"测试角色\",\n  \"description\": \"多模态测试用角色卡\",\n  \"personality\": \"沉稳\",\n  \"scenario\": \"\",\n  \"first_mes\": \"\",\n  \"mes_example\": \"\"\n}",
      "user_response": null,
      "timestamp": "2026-07-19T11:14:44.646031+00:00"
    }
  ],
  "preread_summary": "[S_PREREAD] 数据源类型=character_card, 模板=default。\n预读摘要: [MultimodalArtifact type=character_card native_decode=False vision_degraded=False] {\n  \"name\": \"测试角色\",\n  \"description\": \"多模态测试用角色卡\",\n  \"personality\": \"沉稳\",\n  \"scenario\": \"\",\n  \"first_mes\": \"\",\n  \"mes_example\": \"\"\n}",
  "ambiguity_questions": [
    "1. 角色卡字段映射是否完整？",
    "2. 角色描述是否需要分块存储？"
  ],
  "extracted_content": null,
  "quality_score": null,
  "created_at": "2026-07-19T11:14:44.646031+00:00",
  "updated_at": "2026-07-19T11:14:44.646031+00:00",
  "finalized_at": null,
  "is_finalized": false,
  "error_message": null
}