{
  "session_id": "e0eb196b-3ea3-4c68-97c8-d38194f8a9a6",
  "source_type": "audio",
  "source_ref": "test://e2e/audio.wav",
  "state": "S_PREREAD",
  "template_id": "default",
  "max_turns": 5,
  "ask_user_on_ambiguity": true,
  "turns": [
    {
      "turn_index": 0,
      "state": "S_INIT",
      "agent_action": "proceed",
      "agent_output": "[DistillationService] 初始化会话",
      "user_response": null,
      "timestamp": "2026-07-18T14:58:31.749399+00:00"
    },
    {
      "turn_index": 1,
      "state": "S_PREREAD",
      "agent_action": "proceed",
      "agent_output": "[S_PREREAD] 数据源类型=audio, 模板=default。\n预读摘要: [DistillationService] MultimodalPipeline 预处理降级: source_type=audio, source_ref=test://e2e/audio.wav, error=audio 文件不存在（404）: test://e2e/audio.wav",
      "user_response": null,
      "timestamp": "2026-07-18T14:58:31.749399+00:00"
    }
  ],
  "preread_summary": "[S_PREREAD] 数据源类型=audio, 模板=default。\n预读摘要: [DistillationService] MultimodalPipeline 预处理降级: source_type=audio, source_ref=test://e2e/audio.wav, error=audio 文件不存在（404）: test://e2e/audio.wav",
  "ambiguity_questions": [
    "1. 音频转录的语种是否需要标注？",
    "2. 说话人分离是否需要启用？"
  ],
  "extracted_content": null,
  "quality_score": null,
  "created_at": "2026-07-18T14:58:31.749399+00:00",
  "updated_at": "2026-07-18T14:58:31.749399+00:00",
  "finalized_at": null,
  "is_finalized": false,
  "error_message": null
}