{
  "session_id": "b12c8538-2d01-4d3a-bb1e-8e549b56962e",
  "source_type": "text",
  "source_ref": "信息很少的源",
  "state": "S_QUESTION",
  "template_id": "default",
  "max_turns": 5,
  "ask_user_on_ambiguity": true,
  "turns": [
    {
      "turn_index": 0,
      "state": "S_INIT",
      "agent_action": "proceed",
      "agent_output": "[DistillationService] 初始化会话",
      "user_response": null,
      "timestamp": "2026-07-18T14:58:31.430247+00:00"
    },
    {
      "turn_index": 1,
      "state": "S_PREREAD",
      "agent_action": "proceed",
      "agent_output": "[S_PREREAD] 数据源类型=text, 模板=default。\n预读摘要: [MultimodalArtifact type=text native_decode=False vision_degraded=False] 信息很少的源",
      "user_response": null,
      "timestamp": "2026-07-18T14:58:31.430247+00:00"
    },
    {
      "turn_index": 2,
      "state": "S_QUESTION",
      "agent_action": "proceed",
      "agent_output": "[DistillationService] 进入 S_QUESTION 状态",
      "user_response": "嗯",
      "timestamp": "2026-07-18T14:58:31.454051+00:00"
    }
  ],
  "preread_summary": "[S_PREREAD] 数据源类型=text, 模板=default。\n预读摘要: [MultimodalArtifact type=text native_decode=False vision_degraded=False] 信息很少的源",
  "ambiguity_questions": [
    "1. 文本中的关键实体是否需要归一化？",
    "2. 时间戳是否需要转换为 UTC？"
  ],
  "extracted_content": null,
  "quality_score": null,
  "created_at": "2026-07-18T14:58:31.430247+00:00",
  "updated_at": "2026-07-18T14:58:31.454051+00:00",
  "finalized_at": null,
  "is_finalized": false,
  "error_message": null
}