{
  "session_id": "a1104ada-b6b4-4065-8b10-28268b8432fc",
  "source_type": "text",
  "source_ref": "E2E finalize 测试源",
  "state": "S_FINALIZE",
  "template_id": "default",
  "max_turns": 5,
  "ask_user_on_ambiguity": true,
  "turns": [
    {
      "turn_index": 0,
      "state": "S_INIT",
      "agent_action": "proceed",
      "agent_output": "[DistillationService] 初始化会话",
      "user_response": null,
      "timestamp": "2026-07-18T14:58:31.462603+00:00"
    },
    {
      "turn_index": 1,
      "state": "S_PREREAD",
      "agent_action": "proceed",
      "agent_output": "[S_PREREAD] 数据源类型=text, 模板=default。\n预读摘要: [MultimodalArtifact type=text native_decode=False vision_degraded=False] E2E finalize 测试源",
      "user_response": null,
      "timestamp": "2026-07-18T14:58:31.462603+00:00"
    },
    {
      "turn_index": 2,
      "state": "S_QUESTION",
      "agent_action": "proceed",
      "agent_output": "[DistillationService] 进入 S_QUESTION 状态",
      "user_response": "继续推进",
      "timestamp": "2026-07-18T14:58:31.471370+00:00"
    },
    {
      "turn_index": 3,
      "state": "S_REFLECT",
      "agent_action": "proceed",
      "agent_output": "[DistillationService] 进入 S_REFLECT 状态",
      "user_response": "继续推进",
      "timestamp": "2026-07-18T14:58:31.501263+00:00"
    },
    {
      "turn_index": 4,
      "state": "S_QUESTION",
      "agent_action": "reflect",
      "agent_output": "[DistillationService] D4 决策回环至 S_QUESTION (redistill_count=1, max_redistill_turns=2)",
      "user_response": "继续推进",
      "timestamp": "2026-07-18T14:58:31.532213+00:00"
    },
    {
      "turn_index": 5,
      "state": "S_REFLECT",
      "agent_action": "proceed",
      "agent_output": "[DistillationService] 进入 S_REFLECT 状态",
      "user_response": "继续推进",
      "timestamp": "2026-07-18T14:58:31.563291+00:00"
    },
    {
      "turn_index": 6,
      "state": "S_CROSSVALIDATE",
      "agent_action": "proceed",
      "agent_output": "[DistillationService] D4 决策不回环，进入 S_CROSSVALIDATE (redistill_count=1, max_redistill_turns=2)",
      "user_response": "继续推进",
      "timestamp": "2026-07-18T14:58:31.572874+00:00"
    },
    {
      "turn_index": 7,
      "state": "S_FINALIZE",
      "agent_action": "finalize",
      "agent_output": "importance=0.75 >= importance_threshold_permanent=0.7，存入永久记忆",
      "user_response": null,
      "timestamp": "2026-07-18T14:58:31.631816+00:00"
    }
  ],
  "preread_summary": "[S_PREREAD] 数据源类型=text, 模板=default。\n预读摘要: [MultimodalArtifact type=text native_decode=False vision_degraded=False] E2E finalize 测试源",
  "ambiguity_questions": [
    "1. 文本中的关键实体是否需要归一化？",
    "2. 时间戳是否需要转换为 UTC？"
  ],
  "extracted_content": null,
  "quality_score": 0.931,
  "created_at": "2026-07-18T14:58:31.462603+00:00",
  "updated_at": "2026-07-18T14:58:31.631816+00:00",
  "finalized_at": "2026-07-18T14:58:31.631816+00:00",
  "is_finalized": true,
  "error_message": null
}