{
  "session_id": "51e1fa97-f984-43e6-9373-56c5f1c1de57",
  "source_type": "text",
  "source_ref": "你好，我是测试 agent",
  "state": "S_QUESTION",
  "template_id": "default",
  "max_turns": 5,
  "ask_user_on_ambiguity": true,
  "turns": [
    {
      "turn_index": 0,
      "state": "S_INIT",
      "agent_action": "proceed",
      "agent_output": "[DistillationService] 初始化会话",
      "user_response": null,
      "timestamp": "2026-07-18T14:54:52.065003+00:00"
    },
    {
      "turn_index": 1,
      "state": "S_PREREAD",
      "agent_action": "proceed",
      "agent_output": "[S_PREREAD] 数据源类型=text, 模板=default。\n预读摘要: [MultimodalArtifact type=text native_decode=False vision_degraded=False] 你好,我是测试 agent",
      "user_response": null,
      "timestamp": "2026-07-18T14:54:52.065003+00:00"
    },
    {
      "turn_index": 2,
      "state": "S_QUESTION",
      "agent_action": "proceed",
      "agent_output": "[DistillationService] 进入 S_QUESTION 状态",
      "user_response": "E2E 第1轮回应",
      "timestamp": "2026-07-18T14:54:52.074527+00:00"
    },
    {
      "turn_index": 3,
      "state": "S_REFLECT",
      "agent_action": "proceed",
      "agent_output": "[DistillationService] 进入 S_REFLECT 状态",
      "user_response": "E2E 第2轮回应",
      "timestamp": "2026-07-18T14:54:52.083332+00:00"
    },
    {
      "turn_index": 4,
      "state": "S_QUESTION",
      "agent_action": "reflect",
      "agent_output": "[DistillationService] D4 决策回环至 S_QUESTION (redistill_count=1, max_redistill_turns=2)",
      "user_response": "E2E 第3轮回应",
      "timestamp": "2026-07-18T14:54:52.106939+00:00"
    }
  ],
  "preread_summary": "[S_PREREAD] 数据源类型=text, 模板=default。\n预读摘要: [MultimodalArtifact type=text native_decode=False vision_degraded=False] 你好,我是测试 agent",
  "ambiguity_questions": [
    "1. 文本中的关键实体是否需要归一化？",
    "2. 时间戳是否需要转换为 UTC？"
  ],
  "extracted_content": null,
  "quality_score": null,
  "created_at": "2026-07-18T14:54:52.065003+00:00",
  "updated_at": "2026-07-18T14:54:52.106939+00:00",
  "finalized_at": null,
  "is_finalized": false,
  "error_message": null
}